<?xml version="1.0" encoding="UTF-8"?>
<transmission_wrapper xmlns:xsi="http://www.w3.org/2001/XMLSchema-instance" xsi:noNamespaceSchemaLocation="input_wrapper.xsd">
    <schematron_href value="file:/C:/SVN/AORTA/trunk/Zorgtoepassing/PerinataleZorg/DECOR/peri20-runtime-develop/peri20-ksgz-alg-23.sch"/>
    <schema_location value="urn:hl7-org:v3 file:/C:/SVN/AORTA/trunk/XML/schemas_codeGen/REPC_IN004014NL.xsd"/>
    <!-- vaste waarde voor Kernset -->
    <root_xml_element value="REPC_IN004014NL"/>
    <!-- assign proper OID and generate unique id -->
    <id value="generate_id" root="1.2.3.999"/>
    <!-- generate date/time of message creation -->
    <creation_time value="generate_time"/>
    <!-- vaste waarde voor Kernset -->
    <interaction_id value="REPC_IN004014NL"/>
    <!-- vaste waarde voor Kernset -->
    <accept_ack_code value="AL"/>
    <receiver>
        <!-- vaste waarden voor Perined -->
        <id value="2BFilledWithRealValue" root="1.2.3.999"/>
        <name value="Perined"/>
    </receiver>
    <sender>
        <!-- afhankelijk van zendende instelling/softwareapplicatie -->
        <id value="2BFilledWithRealValue" root="1.2.3.999"/>
        <name value="Verloskundige praktijk X"/>
    </sender>
    <controlact_wrapper>
        <author_or_performer>
            <assigned_person>
                <id value="123456789" root="2.16.528.1.1007.3.1"/>
                <id value="12345678" root="2.16.840.1.113883.2.4.6.1"/>
                <!-- Zorgverlenertype -->
                <code value="01.046" code="01.046" codeSystem="2.16.840.1.113883.2.4.15.111" displayName="Gynaecoloog"/>
                <name value="Peter van den Broek"/>
                <organization>
                    <!-- eigen OID -->
                    <id value="2BFilledWithRealValue" root="2.16.840.1.113883.2.4.3.11.21"/>
                    <!-- URA -->
                    <id value="13265478" root="2.16.528.1.1007.3.3"/>
                    <code value="V4" code="V4" codeSystem="2.16.840.1.113883.2.4.15.1060" displayName="Ziekenhuis"/>
                    <name value="Ziekenhuis X"/>
                    <address>
                        <city value="Lutjebroek"/>
                    </address>
                </organization>
            </assigned_person>
        </author_or_performer>
        <overseer>
            <assigned_person>
                <id value="123456798" root="2.16.528.1.1007.3.1"/>
                <id value="12365487" root="2.16.840.1.113883.2.4.6.1"/>
                <!-- Zorgverlenertype -->
                <code value="01.046" code="01.046" codeSystem="2.16.840.1.113883.2.4.15.111" displayName="Gynaecoloog"/>
                <name value="Peter van den Broek"/>
                <organization>
                    <!-- eigen OID -->
                    <id value="2BFilledWithRealValue" root="2.16.840.1.113883.2.4.3.11.21"/>
                    <!-- URA -->
                    <id value="12346548" root="2.16.528.1.1007.3.3"/>
                    <code value="V4" code="V4" codeSystem="2.16.840.1.113883.2.4.15.1060" displayName="Ziekenhuis"/>
                    <name value="Ziekenhuis X"/>
                    <address>
                        <city value="Lutjebroek"/>
                    </address>
                </organization>
            </assigned_person>
        </overseer>
        <registration_wrapper>
            <!-- vaste waarde voor Kernset -->
            <code value="900000" code="900000" codeSystem="2.16.840.1.113883.2.4.15.4" displayName="Perinatale Care Provision"/>
            <effective_time>
                <low value="2017-08-08T12:30:30"/>
            </effective_time>
            <!-- Hier komt de echte Payload van de Kernset -->

        </registration_wrapper>
    </controlact_wrapper>
</transmission_wrapper>
